name_en,name_ru,mood_en,mood_ru,description_en,description_ru,object_type_en,object_type_ru,image_path
North America Nebula,Туманность Северная Америка,"expansive, bright, recognizable","масштабный, яркий, узнаваемый","The North America Nebula is an emission nebula in the constellation Cygnus, close to Deneb in the night sky. It is named because its shape resembles North America.","Туманность Северная Америка — эмиссионная туманность в созвездии Лебедя, недалеко от Денеба на ночном небе. Он назван так потому, что его форма напоминает Северную Америку.",nebula,туманность,data/curated_space_objects/images/north_america_nebula.jpg
Butterfly Nebula,Туманность Бабочка,"symmetric, fiery, graceful","симметричный, огненный, грациозный","Butterfly Nebula may refer to:Planetary Nebula M2-9 NGC 6302, a bipolar planetary nebula in the constellation Scorpius NGC 2346 Little Dumbbell Nebula Sadr Region","Туманность Бабочка может означать: Планетарная туманность M2-9 NGC 6302, биполярная планетарная туманность в созвездии Скорпиона NGC 2346 Туманность Маленькая Гантель в регионе Садр.",planetary nebula,планетарная туманность,data/curated_space_objects/images/butterfly_nebula.jpg
Eskimo Nebula,Туманность Эскимос,"quirky, bright, eccentric","причудливый, яркий, эксцентричный","The Eskimo Nebula, also known as the Clown Face Nebula, Lion Nebula, or Caldwell 39, is a bipolar double-shell planetary nebula (PN). It was discovered by astronomer William Herschel in 1787.","Туманность Эскимос, также известная как Туманность Лицо Клоуна, Туманность Льва или Колдуэлл 39, представляет собой биполярную планетарную туманность с двойной оболочкой (ПН). Его открыл астроном Уильям Гершель в 1787 году.",planetary nebula,планетарная туманность,data/curated_space_objects/images/eskimo_nebula.jpg
Dumbbell Nebula,Туманность Гантель,"soft, balanced, glowing","мягкий, уравновешенный, сияющий","The Dumbbell Nebula is a planetary nebula in the constellation Vulpecula, at a distance of about 1360 light-years. It was the first such nebula to be discovered, by Charles Messier in 1764.","Туманность Гантель — планетарная туманность в созвездии Лисички, находящаяся на расстоянии около 1360 световых лет. Это была первая подобная туманность, открытая Шарлем Мессье в 1764 году.",planetary nebula,планетарная туманность,data/curated_space_objects/images/dumbbell_nebula.jpg
Little Dumbbell Nebula,Туманность Маленькая Гантель,"unusual, bright, focused","необычный, яркий, сосредоточенный","The Little Dumbbell Nebula, also known as Messier 76, NGC 650/651, the Barbell Nebula, or the Cork Nebula, is a planetary nebula in the northern constellation of Perseus. It was discovered by Pierre Méchain in 1780 and included in Charles Messier's catalog of comet-like objects.","Туманность Маленькая Гантель, также известная как Мессье 76, NGC 650/651, Туманность Штанга или Туманность Корк, — планетарная туманность в северном созвездии Персея. Она была открыта Пьером Мешеном в 1780 году и включена в каталог кометоподобных объектов Шарля Мессье.",planetary nebula,планетарная туманность,data/curated_space_objects/images/little_dumbbell_nebula.jpg
Flame Nebula,Туманность Пламя,"fiery, warm, dramatic","огненный, теплый, драматичный","The Flame Nebula, designated as NGC 2024 and Sh2-277, is an emission nebula in the constellation Orion. It is about 1350 light-years away.","Туманность Пламя, обозначаемая как NGC 2024 и Sh2-277, представляет собой эмиссионную туманность в созвездии Ориона. Это около 1350 световых лет от нас.",nebula,туманность,data/curated_space_objects/images/flame_nebula.jpg
California Nebula,Туманность Калифорния,"open, warm, relaxed","открытый, тёплый, расслабленный",The California Nebula is an emission nebula located in the constellation Perseus. Its name comes from its resemblance to the outline of the U.S.,"Туманность Калифорния — эмиссионная туманность, расположенная в созвездии Персея. Его название происходит от сходства с очертаниями США.",nebula,туманность,data/curated_space_objects/images/california_nebula.jpg
Cone Nebula,Туманность Конус,"pointed, dark, focused","острый, тёмный, сосредоточенный","The Cone Nebula is an H II region in the constellation of Monoceros. It was discovered by William Herschel on December 26, 1785, at which time he designated it H V.27.","Туманность Конус — область H II в созвездии Единорога. Он был открыт Уильямом Гершелем 26 декабря 1785 года, тогда он обозначил его H V.27.",nebula,туманность,data/curated_space_objects/images/cone_nebula.jpg
Witch Head Nebula,Туманность Голова Ведьмы,"ghostly, eerie, poetic","призрачный, жутковатый, поэтичный","IC 2118 is an extremely faint reflection nebula believed to be an ancient supernova remnant or gas cloud illuminated by nearby supergiant star Rigel in the constellation of Orion. The nebula lies in the Eridanus Constellation, about 900 light-years from Earth.","IC 2118 — чрезвычайно слабая отражательная туманность, предположительно являющаяся остатком древней сверхновой или газовым облаком, освещенным ближайшей сверхгигантской звездой Ригель в созвездии Ориона. Туманность находится в созвездии Эридана, примерно в 900 световых годах от Земли.",reflection nebula,отражательная туманность,data/curated_space_objects/images/witch_head_nebula.jpg
Iris Nebula,Туманность Ирис,"serene, delicate, elegant","безмятежный, деликатный, элегантный","The Iris Nebula is a bright reflection nebula located about 1,300 light years from Earth in the constellation of Cepheus. It is six light-years across.","Туманность Ирис — яркая отражательная туманность, расположенная примерно в 1300 световых годах от Земли в созвездии Цефея. Его диаметр составляет шесть световых лет.",reflection nebula,отражательная туманность,data/curated_space_objects/images/iris_nebula.jpg
Heart Nebula,Туманность Сердце,"warm, sincere, glowing","тёплый, искренний, светлый","The Heart Nebula is an emission nebula, 7,500 light-years (2,300 pc) away from Earth and located in the Perseus Arm of the Galaxy in the constellation Cassiopeia. It was discovered by William Herschel on 3 November 1787.","Туманность Сердце — эмиссионная туманность, находящаяся на расстоянии 7500 световых лет (2300 пк) от Земли и расположенная в Рукаве Персея Галактики в созвездии Кассиопеи. Он был открыт Уильямом Гершелем 3 ноября 1787 года.",nebula,туманность,data/curated_space_objects/images/heart_nebula.jpg
Soul Nebula,Туманность Души,"deep, warm, emotional","глубокий, теплый, эмоциональный",Westerhout 5 is an emission nebula located in Cassiopeia. Several small open clusters are embedded in the nebula: Collinder 33 and 34 in the head and IC 1848 in the body.,"Вестерхаут 5 — эмиссионная туманность, расположенная в Кассиопее. В туманность встроено несколько небольших рассеянных скоплений: Коллиндер 33 и 34 в голове и IC 1848 в теле.",nebula,туманность,data/curated_space_objects/images/soul_nebula.jpg
Bubble Nebula,Туманность Пузырь,"light, playful, fragile","легкий, игривый, хрупкий","The Bubble Nebula, also known as NGC 7635, Sharpless 162, or Caldwell 11, is an H II region emission nebula in the constellation Cassiopeia. It lies close to the open cluster Messier 52.","Туманность Пузырь, также известная как NGC 7635, Шарплесс 162 или Колдуэлл 11, представляет собой эмиссионную туманность области H II в созвездии Кассиопеи. Оно расположено недалеко от рассеянного скопления Мессье 52.",nebula,туманность,data/curated_space_objects/images/bubble_nebula.jpg
Elephant's Trunk Nebula,Туманность Слоновий Хобот,"grounded, patient, strong","устойчивый, терпеливый, сильный","The Elephant's Trunk Nebula is a concentration of interstellar gas and dust within the much larger ionized gas region IC 1396 located in the constellation Cepheus about 2,400 light years away from Earth. The nebula is a dark, dense globule that gets its name from its appearance.","Туманность Слоновий Хобот — это скопление межзвездного газа и пыли в гораздо большей области ионизированного газа IC 1396, расположенной в созвездии Цефея примерно в 2400 световых годах от Земли. Туманность представляет собой темную плотную глобулу, получившую свое название от своего внешнего вида.",nebula,туманность,data/curated_space_objects/images/elephant_s_trunk_nebula.jpg
Seagull Nebula,Туманность Чайка,"airy, light, free","воздушный, лёгкий, свободный",IC 2177 is a region of nebulosity that lies along the border between the constellations Monoceros and Canis Major. It is a roughly circular H II region centered on the Be star HD 53367.,"IC 2177 — это область туманности, расположенная вдоль границы между созвездиями Единорога и Большого Пса. Это примерно круглая область H II с центром в Be-звезде HD 53367.",nebula,туманность,data/curated_space_objects/images/seagull_nebula.jpg
Monkey Head Nebula,Туманность Голова Обезьяны,"funny, warm, expressive","забавный, теплый, выразительный",NGC 2174 is an H II emission nebula located in the constellation Orion and is associated with the open star cluster NGC 2175. It was discovered on 6 February 1877 by French astronomer Édouard Stephan.,"NGC 2174 — эмиссионная туманность H II, расположенная в созвездии Ориона и связанная с рассеянным звездным скоплением NGC 2175. Она была открыта 6 февраля 1877 года французским астрономом Эдуардом Стефаном.",nebula,туманность,data/curated_space_objects/images/monkey_head_nebula.jpg
Thor's Helmet,Шлем Тора,"heroic, bold, windy","героический, смелый, ветреный","NGC 2359 is an emission nebula in the constellation Canis Major. The nebula is approximately 3,670 parsecs away and 30 light-years in size.",NGC 2359 — эмиссионная туманность в созвездии Большого Пса. Туманность находится на расстоянии примерно 3670 парсеков и имеет размер 30 световых лет.,nebula,туманность,data/curated_space_objects/images/thor_s_helmet.jpg
Crescent Nebula,Туманность Полумесяц,"fierce, luminous, graceful","яростный, светящийся, изящный","The Crescent Nebula is an emission nebula in the constellation Cygnus, about 5000 light-years away from Earth. It was discovered by William Herschel in 1792.","Туманность Полумесяц — эмиссионная туманность в созвездии Лебедя, расположенная примерно в 5000 световых годах от Земли. Его открыл Уильям Гершель в 1792 году.",nebula,туманность,data/curated_space_objects/images/crescent_nebula.jpg
Pleiades,Плеяды,"sparkling, social, youthful","искрящийся, общительный, юный","The Pleiades, also known as Seven Sisters and Messier 45 (M45), is an asterism of an open star cluster containing young B-type stars in the northwest of the constellation Taurus. At a distance of about 444 light-years, it is among the nearest star clusters to Earth and the.","Плеяды, также известные как Семь сестер и Мессье 45 (M45), представляют собой астеризм рассеянного звездного скопления, содержащего молодые звезды B-типа, на северо-западе созвездия Тельца. На расстоянии около 444 световых лет оно находится среди ближайших к Земле звездных скоплений.",star cluster,звездное скопление,data/curated_space_objects/images/pleiades.jpg
Hyades,Гиады,"wise, warm, steady","мудрый, теплый, устойчивый","The Hyades is the nearest open cluster and one of the best-studied star clusters. Located about 153 light-years away from the Sun, it consists of a roughly spherical group of hundreds of stars sharing the same age, place of origin, chemical characteristics, and motion through.","Гиады — ближайшее рассеянное скопление и одно из наиболее изученных звездных скоплений. Расположенная примерно в 153 световых годах от Солнца, она состоит из примерно сферической группы сотен звезд, имеющих одинаковый возраст, место происхождения, химические характеристики и движение.",star cluster,звездное скопление,data/curated_space_objects/images/hyades.jpg
Omega Centauri,Омега Центавра,"profound, ancient, wise","глубокий, древний, мудрый","Omega Centauri is a globular cluster in the constellation of Centaurus that was first identified as a non-stellar object by Edmond Halley in 1677. Located at a distance of 17,090 light-years, it is the largest known globular cluster in the Milky Way at a diameter of roughly 150.","Омега Центавра — это шаровое скопление в созвездии Центавра, которое впервые было идентифицировано как незвездный объект Эдмондом Галлеем в 1677 году. Расположенное на расстоянии 17 090 световых лет, это самое большое известное шаровое скопление в Млечном Пути с диаметром примерно 150.",globular cluster,шаровое скопление,data/curated_space_objects/images/omega_centauri.jpg
47 Tucanae,47 Тукана,"concentrated, warm, old-soul","собранный, тёплый, мудрый не по годам","47 Tucanae or 47 Tuc is a globular cluster located in the constellation Tucana. It is about 4.45 ± 0.01 kpc (14,500 ± 32.6 ly) from Earth, and 120 light years in diameter.","47 Tucanae или 47 Tuc — шаровое скопление, расположенное в созвездии Тукана. Он находится на расстоянии около 4,45 ± 0,01 кпк (14 500 ± 32,6 св. лет) от Земли и имеет диаметр 120 световых лет.",globular cluster,шаровое скопление,data/curated_space_objects/images/47_tucanae.jpg
Hercules Globular Cluster,Шаровое скопление Геркулеса,"deep, bright, wise","глубокий, яркий, мудрый","Messier 13, or M13, is a globular cluster of several hundred thousand stars in the constellation of Hercules.","Мессье 13, или М13, — шаровое скопление из нескольких сотен тысяч звезд в созвездии Геркулеса.",globular cluster,шаровое скопление,data/curated_space_objects/images/hercules_globular_cluster.jpg
Beehive Cluster,Скопление Улей,"social, bright, friendly","общительный, яркий, дружелюбный","The Beehive Cluster is an open cluster in the constellation Cancer. One of the nearest open clusters to Earth, it contains a larger population of stars than other nearby bright open clusters holding around 1,000 stars.","Скопление Улей — рассеянное скопление в созвездии Рака. Это одно из ближайших к Земле рассеянных скоплений. Оно содержит большее количество звезд, чем другие близлежащие яркие рассеянные скопления, содержащие около 1000 звезд.",open cluster,рассеянное скопление,data/curated_space_objects/images/beehive_cluster.jpg
Jewel Box Cluster,Скопление Шкатулка Драгоценностей,"colorful, bright, refined","яркий, сияющий, изысканный","The Jewel Box is an open cluster in the constellation Crux, originally discovered by Nicolas Louis de Lacaille in 1751–1752. This cluster was later named the Jewel Box by John Herschel when he described its telescopic appearance as ""...","Шкатулка с драгоценностями — рассеянное скопление в созвездии Креста, первоначально открытое Николя Луи де Лакайлем в 1751–1752 годах. Позже Джон Гершель назвал это скопление «Шкатулкой для драгоценностей», когда он описал его телескопический вид как «...",open cluster,рассеянное скопление,data/curated_space_objects/images/jewel_box_cluster.jpg
Quintuplet Cluster,Скопление Квинтуплет,"rare, energetic, intense","редкий, энергичный, интенсивный",The Quintuplet Cluster is a dense cluster of massive young stars about 100 light years from the Galactic Center (GC). Its name comes from the fact it has five prominent infrared sources residing in it.,"Скопление Квинтуплет — это плотное скопление массивных молодых звезд примерно в 100 световых годах от Галактического центра (ГЦ). Его название происходит от того факта, что в нем расположены пять ярких источников инфракрасного излучения.",star cluster,звездное скопление,data/curated_space_objects/images/quintuplet_cluster.jpg
Arches Cluster,Скопление Арки,"powerful, young, bold","мощный, молодой, дерзкий","The Arches Cluster is one of the densest star clusters in the Milky Way, about 100 light-years from its center in the constellation Sagittarius, 25,000 light-years from Earth. Its discovery was reported by Nagata et al.","Скопление Арки — одно из самых плотных звездных скоплений Млечного Пути, расположенное примерно в 100 световых годах от его центра в созвездии Стрельца и в 25 000 световых годах от Земли. О его открытии сообщили Нагата и др.",star cluster,звездное скопление,data/curated_space_objects/images/arches_cluster.jpg
Saturn,Сатурн,"elegant, distinguished, calm","элегантный, выдающийся, спокойный","Saturn is the sixth planet from the Sun and the second largest in the Solar System, after Jupiter. It is a gas giant, with an average radius of about 9 times that of Earth.","Сатурн — шестая планета от Солнца и вторая по величине в Солнечной системе после Юпитера. Это газовый гигант, средний радиус которого примерно в 9 раз больше радиуса Земли.",planet,планета,data/curated_space_objects/images/saturn.jpg
Jupiter,Юпитер,"grand, confident, stormy","грандиозный, уверенный, бурный","Jupiter is the fifth planet from the Sun, and the largest in the Solar System. It is a gas giant with a mass nearly 2.5 times that of all the other planets in the Solar System combined and slightly less than one-thousandth the mass of the Sun.","Юпитер — пятая планета от Солнца и самая большая в Солнечной системе. Это газовый гигант, масса которого почти в 2,5 раза превышает массу всех остальных планет Солнечной системы вместе взятых, и чуть менее одной тысячной массы Солнца.",planet,планета,data/curated_space_objects/images/jupiter.jpg
Mars,Марс,"bold, rugged, adventurous","смелый, закалённый, авантюрный","Mars is the fourth planet from the Sun. It is also known as the ""Red Planet"", for its orange-red appearance.",Марс — четвертая планета от Солнца. Она также известна как «Красная планета» из-за своего оранжево-красного цвета.,planet,планета,data/curated_space_objects/images/mars.jpg
Venus,Венера,"bright, mysterious, intense","яркий, загадочный, интенсивный","Venus is the second planet from the Sun. Similar in size and mass to Earth, Venus has no liquid water, and its atmosphere is far thicker and denser than that of any other rocky body in the Solar System.","Венера – вторая планета от Солнца. Венера, похожая по размеру и массе на Землю, не имеет жидкой воды, а ее атмосфера намного толще и плотнее, чем у любого другого каменистого тела Солнечной системы.",planet,планета,data/curated_space_objects/images/venus.jpg
Neptune,Нептун,"deep, dreamy, distant","глубокий, мечтательный, далёкий","Neptune is the eighth and farthest known planet orbiting the Sun. It is the fourth-largest planet in the Solar System by diameter, the third-most-massive planet, and the densest giant planet.","Нептун — восьмая и самая дальняя известная планета, вращающаяся вокруг Солнца. Это четвертая по величине планета Солнечной системы по диаметру, третья по массе планета и самая плотная планета-гигант.",planet,планета,data/curated_space_objects/images/neptune.jpg
Uranus,Уран,"unusual, quiet, detached","необычный, тихий, отстранённый",Uranus is the seventh planet from the Sun. It is a gaseous cyan-coloured ice giant.,Уран — седьмая планета от Солнца. Это газообразный ледяной гигант голубого цвета.,planet,планета,data/curated_space_objects/images/uranus.jpg
