name_en,name_ru,mood_en,mood_ru,description_en,description_ru,object_type_en,object_type_ru,image_path
Andromeda Galaxy,Галактика Андромеды,"majestic, calm, magnetic","величественный, спокойный, притягательный",The Andromeda Galaxy is a barred spiral galaxy and is the nearest major galaxy to the Milky Way.,Галактика Андромеды — спиральная галактика с перемычкой и ближайшая к Млечному Пути крупная галактика.,galaxy,галактика,data/curated_space_objects/images/andromeda_galaxy.jpg
Milky Way,Млечный Путь,"familiar, dreamy, infinite","знакомый, мечтательный, бесконечный",The Milky Way is the galaxy that includes the Solar System: a hazy band of light seen in the night sky formed from stars in other arms of the galaxy,"Млечный Путь — это галактика, включающая Солнечную систему: туманная полоса света, видимая в ночном небе, образованная звездами в других рукавах галактики.",galaxy,галактика,data/curated_space_objects/images/milky_way.jpg
Sombrero Galaxy,Галактика Сомбреро,"stylish, mysterious, elegant","стильный, загадочный, элегантный","The Sombrero Galaxy is a peculiar galaxy of unclear classification in the constellation borders of Virgo and Corvus, being about 9.55 megaparsecs from the Milky Way galaxy.","Галактика Сомбреро — своеобразная галактика неясной классификации в границах созвездий Девы и Ворона, находящаяся примерно в 9,55 мегапарсеках от галактики Млечный Путь.",galaxy,галактика,data/curated_space_objects/images/sombrero_galaxy.jpg
Whirlpool Galaxy,Галактика Водоворот,"dramatic, social, magnetic","драматичный, общительный, притягательный","The Whirlpool Galaxy is an interacting grand-design spiral galaxy with a Seyfert 2 active galactic nucleus. It lies in the constellation Canes Venatici, and was the first galaxy to be classified as a spiral galaxy.","Галактика Водоворот — это взаимодействующая спиральная галактика грандиозного дизайна с активным галактическим ядром Сейферта-2. Она находится в созвездии Гончих Псов и была первой галактикой, классифицированной как спиральная галактика.",galaxy,галактика,data/curated_space_objects/images/whirlpool_galaxy.jpg
Triangulum Galaxy,Галактика Треугольника,"soft, open, luminous","мягкий, открытый, сияющий","The Triangulum Galaxy is a spiral galaxy 2.8 million light-years from Earth in the constellation Triangulum. The Triangulum Galaxy is the third-largest member of the Local Group of galaxies, behind the Andromeda Galaxy and the Milky Way.","Галактика Треугольника — спиральная галактика в 2,8 миллионах световых лет от Земли в созвездии Треугольника. Галактика Треугольника является третьим по величине членом Местной группы галактик после Галактики Андромеды и Млечного Пути.",galaxy,галактика,data/curated_space_objects/images/triangulum_galaxy.jpg
Pinwheel Galaxy,Галактика Вертушка,"playful, bright, structured","игривый, яркий, собранный","The Pinwheel Galaxy is a face-on, counterclockwise intermediate spiral galaxy located 21 million light-years from Earth in the constellation Ursa Major.","Галактика Вертушка — это промежуточная спиральная галактика, обращенная лицом вниз и против часовой стрелки, расположенная на расстоянии 21 миллиона световых лет от Земли в созвездии Большой Медведицы.",galaxy,галактика,data/curated_space_objects/images/pinwheel_galaxy.jpg
Cigar Galaxy,Галактика Сигара,"restless, mysterious, intense","неугомонный, загадочный, интенсивный","Messier 82 (also known as NGC 3034, Cigar Galaxy or M82) is a starburst galaxy approximately 12 million light-years away in the constellation Ursa Major.","Мессье 82 (также известная как NGC 3034, Сигарная галактика или M82) — галактика со вспышкой звезд, расположенная примерно в 12 миллионах световых лет от нас в созвездии Большой Медведицы.",galaxy,галактика,data/curated_space_objects/images/cigar_galaxy.jpg
Sunflower Galaxy,Галактика Подсолнух,"warm, vibrant, generous","тёплый, живой, щедрый","Messier 63 or M63, also known as NGC 5055 or the seldom-used Sunflower Galaxy, is a spiral galaxy in the northern constellation of Canes Venatici with approximately 400 billion stars.","Мессье 63 или M63, также известная как NGC 5055 или редко используемая галактика Подсолнух, представляет собой спиральную галактику в северном созвездии Гончих Псов, содержащую примерно 400 миллиардов звезд.",galaxy,галактика,data/curated_space_objects/images/sunflower_galaxy.jpg
Black Eye Galaxy,Галактика Черный Глаз,"moody, dramatic, sharp","мрачноватый, драматичный, резкий",The Black Eye Galaxy is a relatively isolated spiral galaxy 17 million light-years away in the constellation of Coma Berenices.,"Галактика Черный Глаз — относительно изолированная спиральная галактика, расположенная на расстоянии 17 миллионов световых лет в созвездии Комы Вероники.",galaxy,галактика,data/curated_space_objects/images/black_eye_galaxy.jpg
Needle Galaxy,Галактика-Игла,"delicate, precise, distant","деликатный, точный, отстранённый",NGC 4565 is an edge-on spiral galaxy about 30 to 50 million light-years away in the constellation Coma Berenices. It lies close to the North Galactic Pole and has a visual magnitude of approximately 10.,"NGC 4565 — спиральная галактика, видимая с ребра, находящаяся на расстоянии от 30 до 50 миллионов световых лет в созвездии Вероники. Она расположена недалеко от Северного галактического полюса и имеет визуальную величину около 10.",galaxy,галактика,data/curated_space_objects/images/needle_galaxy.jpg
Sculptor Galaxy,Галактика Скульптор,"expansive, active, glowing","масштабный, активный, сияющий",The Sculptor Galaxy is an intermediate spiral galaxy in the constellation Sculptor. It is currently undergoing a period of intense star formation.,Галактика Скульптор — промежуточная спиральная галактика в созвездии Скульптора. В настоящее время она переживает период интенсивного звездообразования.,galaxy,галактика,data/curated_space_objects/images/sculptor_galaxy.jpg
Centaurus A,Центавр A,"shadowy, powerful, unusual","теневой, мощный, необычный","Centaurus A is a galaxy in the constellation of Centaurus. It is the closest radio galaxy to Earth, as well as the closest BL Lac object.","Центавр А — галактика в созвездии Центавра. Это ближайшая к Земле радиогалактика, а также ближайший объект BL Lac.",galaxy,галактика,data/curated_space_objects/images/centaurus_a.jpg
Antennae Galaxies,Галактики Антенны,"chaotic, intertwined, explosive","хаотичный, переплетённый, взрывной","The Antennae Galaxies are a pair of interacting galaxies in the constellation Corvus. They are currently going through a starburst phase, in which the collision of clouds of gas and dust, with entangled magnetic fields, causes rapid star formation.","Антенные галактики — пара взаимодействующих галактик в созвездии Ворона. В настоящее время они переживают фазу звездообразования, во время которой столкновение облаков газа и пыли с запутанными магнитными полями вызывает быстрое звездообразование.",galaxy,галактика,data/curated_space_objects/images/antennae_galaxies.jpg
Tadpole Galaxy,Галактика Головастик,"odd, playful, whimsical","чудаковатый, игривый, затейливый",The Tadpole Galaxy is a disrupted barred spiral galaxy located 143.6 megaparsecs from Earth in the northern constellation Draco. Its most dramatic feature is a trail of stars.,"Галактика Головастик — это разрушенная спиральная галактика с перемычкой, расположенная на расстоянии 143,6 мегапарсека от Земли в северном созвездии Дракона. Его самая впечатляющая особенность — след звезд.",galaxy,галактика,data/curated_space_objects/images/tadpole_galaxy.jpg
Hoag's Object,Объект Хога,"perfect, rare, detached","идеальный, редкий, отстраненный","Hoag's Object is an unusual ring galaxy in the constellation of Serpens Caput. It is named after Arthur Hoag, who discovered it in 1950 and identified it as either a planetary nebula or a peculiar galaxy.","Объект Хоага — необычная кольцевая галактика в созвездии Головы Змеи. Она названа в честь Артура Хоага, который открыл ее в 1950 году и определил, что это либо планетарная туманность, либо пекулярная галактика.",galaxy,галактика,data/curated_space_objects/images/hoag_s_object.jpg
Mice Galaxies,Галактики Мыши,"mischievous, inseparable, wild","озорной, неразлучный, дикий","Mice Galaxies, are two spiral galaxies in the constellation Coma Berenices. About 105.8 megaparsecs distant, they have begun the process of colliding and merging.","Мышиные галактики — две спиральные галактики в созвездии Комы Вероники. На расстоянии около 105,8 мегапарсеков они начали процесс столкновения и слияния.",galaxy,галактика,data/curated_space_objects/images/mice_galaxies.jpg
Fireworks Galaxy,Галактика Фейерверк,"sparkling, energetic, festive","искрящийся, энергичный, праздничный","Fireworks Galaxy, is a grand design, face-on intermediate spiral galaxy with a small bright nucleus, whose location in the sky straddles the boundary between the northern constellations of Cepheus and Cygnus. Its distance from Earth is about 25.2 million light-years or 7.72.","Галактика Фейерверк — это величественная, обращенная лицом к лицу промежуточная спиральная галактика с небольшим ярким ядром, расположенная на небе на границе между северными созвездиями Цефея и Лебедя. Ее расстояние от Земли составляет около 25,2 миллиона световых лет или 7,72.",galaxy,галактика,data/curated_space_objects/images/fireworks_galaxy.jpg
Southern Pinwheel Galaxy,Южная Галактика Вертушка,"warm, open, expressive","теплый, открытый, выразительный","Messier 83 or M83, also known as the Southern Pinwheel Galaxy, is a barred spiral galaxy approximately 15 million light-years away in the constellation borders of Hydra and Centaurus.","Мессье 83 или M83, также известная как Южная галактика-вертушка, представляет собой спиральную галактику с перемычкой, расположенную примерно в 15 миллионах световых лет от нас и на границе созвездий Гидры и Центавра.",galaxy,галактика,data/curated_space_objects/images/southern_pinwheel_galaxy.jpg
Orion Nebula,Туманность Ориона,"creative, young, energetic","творческий, молодой, энергичный","The Orion Nebula is a bright diffuse nebula in the constellation Orion, visible to the naked eye as part of Orion’s “sword.” It is about 1,267 light-years away and is the closest region of massive star formation to Earth.","Туманность Ориона — яркая диффузная туманность в созвездии Ориона, видимая невооруженным глазом как часть «меча» Ориона. Она находится на расстоянии около 1267 световых лет и является ближайшей к Земле областью массивного звездообразования.",nebula,туманность,data/curated_space_objects/images/orion_nebula.jpg
Crab Nebula,Крабовидная туманность,"electric, intense, restless","электрический, интенсивный, неугомонный",The Crab Nebula is a supernova remnant and pulsar wind nebula in the constellation Taurus. It is linked to a bright supernova observed in AD 1054 and was the first object identified as the remnant of a historically recorded supernova.,"Крабовидная туманность — остаток сверхновой и пульсарная ветровая туманность в созвездии Тельца. Он связан с яркой сверхновой, наблюдавшейся в 1054 году нашей эры, и был первым объектом, идентифицированным как остаток исторически зарегистрированной сверхновой.",supernova remnant,остаток сверхновой,data/curated_space_objects/images/crab_nebula.jpg
Eagle Nebula,Туманность Орла,"grand, iconic, powerful","грандиозный, культовый, мощный","The Eagle Nebula is a young star cluster and star-forming region in the constellation Serpens. It is famous for the “Pillars of Creation,” a gas and dust structure imaged by the Hubble Space Telescope.","Туманность Орла — молодое звездное скопление и область звездообразования в созвездии Змеи. Он известен «Столпами творения» — структурой из газа и пыли, полученной космическим телескопом «Хаббл».",nebula,туманность,data/curated_space_objects/images/eagle_nebula.jpg
Pillars of Creation,Столпы Творения,"legendary, monumental, dramatic","легендарный, монументальный, драматичный","The Pillars of Creation are huge columns of gas and dust in the Eagle Nebula, photographed by the Hubble Space Telescope. They are forming new stars while being slowly eroded by radiation from nearby young stars.","Столпы Творения — это огромные столбы газа и пыли в туманности Орла, сфотографированные космическим телескопом Хаббл. Они формируют новые звезды, медленно разрушаясь под воздействием излучения близлежащих молодых звезд.",nebula,туманность,data/curated_space_objects/images/pillars_of_creation.jpg
Horsehead Nebula,Туманность Конская Голова,"dark, recognizable, reserved","тёмный, узнаваемый, сдержанный","The Horsehead Nebula is a small dark nebula in the constellation Orion, about 1,375 light-years from Earth. It is famous for its distinctive shape, which looks like a horse’s head.","Туманность Конская Голова — небольшая темная туманность в созвездии Ориона, расположенная примерно в 1375 световых годах от Земли. Он известен своей характерной формой, напоминающей голову лошади.",dark nebula,темная туманность,data/curated_space_objects/images/horsehead_nebula.jpg
Helix Nebula,Туманность Улитка,"watchful, mystical, soft","наблюдательный, мистический, мягкий","The Helix Nebula is a nearby planetary nebula in the constellation Aquarius, about 655 light-years from Earth. Because of its eye-like shape, it is sometimes called the “Eye of God” or the “Eye of Sauron” in pop culture.","Туманность Улитка — ближайшая планетарная туманность в созвездии Водолея, примерно в 655 световых годах от Земли. Из-за своей глазообразной формы в поп-культуре его иногда называют «Глазом Бога» или «Глазом Саурона».",planetary nebula,планетарная туманность,data/curated_space_objects/images/helix_nebula.jpg
Ring Nebula,Туманность Кольцо,"elegant, glowing, focused","элегантный, сияющий, сосредоточенный","The Ring Nebula is a planetary nebula in the constellation Lyra, also known as Messier 57. It is too faint to see with the naked eye, but can be observed with a small telescope.","Туманность Кольцо — планетарная туманность в созвездии Лиры, также известная как Мессье 57. Она слишком тусклая, чтобы ее можно было увидеть невооруженным глазом, но ее можно наблюдать в небольшой телескоп.",planetary nebula,планетарная туманность,data/curated_space_objects/images/ring_nebula.jpg
Carina Nebula,Туманность Киля,"stormy, grand, radiant","бурный, грандиозный, сияющий","The Carina Nebula is a large, complex region of bright and dark nebulosity in the constellation Carina. It is located about 8,500 light-years from Earth in the Milky Way.",Туманность Киля — это большая сложная область ярких и темных туманностей в созвездии Киля. Она расположена примерно в 8500 световых годах от Земли в Млечном Пути.,nebula,туманность,data/curated_space_objects/images/carina_nebula.jpg
Tarantula Nebula,Туманность Тарантул,"wild, immense, explosive","дикий, огромный по масштабу, взрывной",The Tarantula Nebula is a large star-forming H II region in the Large Magellanic Cloud. It forms the south-eastern part of that galaxy.,Туманность Тарантул — это большая область звездообразования H II в Большом Магеллановом Облаке. Она образует юго-восточную часть этой галактики.,nebula,туманность,data/curated_space_objects/images/tarantula_nebula.jpg
Lagoon Nebula,Туманность Лагуна,"warm, dreamy, glowing","теплый, мечтательный, сияющий",The Lagoon Nebula is a giant emission nebula and star-forming H II region in the constellation Sagittarius. It is one of the few star-forming nebulae faintly visible to the naked eye.,"Туманность Лагуна — гигантская эмиссионная туманность и область звездообразования H II в созвездии Стрельца. Это одна из немногих туманностей звездообразования, слабо видимых невооруженным глазом.",nebula,туманность,data/curated_space_objects/images/lagoon_nebula.jpg
Trifid Nebula,Трехраздельная туманность,"layered, colorful, complex","многослойный, красочный, сложный","The Trifid Nebula is a star-forming H II region in Sagittarius, discovered by Charles Messier in 1764. It is known for its “three-lobe” shape and combines an open star cluster, emission, reflection, and dark nebulae.","Трехраздельная туманность — это область звездообразования H II в Стрельце, открытая Шарлем Мессье в 1764 году. Она известна своей «трехлепестковой» формой и сочетает в себе рассеянное звездное скопление, эмиссионную, отражательную и темную туманности.",nebula,туманность,data/curated_space_objects/images/trifid_nebula.jpg
Rosette Nebula,Туманность Розетка,"romantic, radiant, tender","романтичный, яркий, нежный","The Rosette Nebula is an H II region located near one end of a giant molecular cloud in the Monoceros region of the Milky Way Galaxy. The open cluster NGC 2244 is closely associated with the nebulosity, the stars of the cluster having been formed from the nebula's matter.","Туманность Розетка — это область H II, расположенная недалеко от одного конца гигантского молекулярного облака в области Единорога Галактики Млечный Путь. С туманностью тесно связано рассеянное скопление NGC 2244, звезды скопления образовались из вещества туманности.",nebula,туманность,data/curated_space_objects/images/rosette_nebula.jpg
Cat's Eye Nebula,Туманность Кошачий Глаз,"sharp, hypnotic, strange","резкий, гипнотический, странный","The Cat's Eye Nebula was a planetary nebula in the northern constellation of Draco, discovered by William Herschel on February 15, 1786. It was the first planetary nebula whose spectrum was investigated by the English amateur astronomer William Huggins, demonstrating that.","Туманность Кошачий Глаз — планетарная туманность в северном созвездии Дракона, открытая Уильямом Гершелем 15 февраля 1786 года. Это была первая планетарная туманность, спектр которой исследовал английский астроном-любитель Уильям Хаггинс, продемонстрировав это.",planetary nebula,планетарная туманность,data/curated_space_objects/images/cat_s_eye_nebula.jpg
Omega Nebula,Туманность Омега,"warm, active, theatrical","теплый, активный, театральный",The Omega Nebula is an H II region in the constellation Sagittarius. It was discovered by Philippe Loys de Chéseaux in 1745.,Туманность Омега — это область H II в созвездии Стрельца. Его открыл Филипп Луа де Шезо в 1745 году.,nebula,туманность,data/curated_space_objects/images/omega_nebula.jpg
Veil Nebula,Туманность Вуаль,"delicate, ghostly, elegant","деликатный, призрачный, элегантный",The Veil Nebula is a cloud of heated and ionized gas and dust in the constellation Cygnus.,Туманность Вуаль — это облако нагретого ионизированного газа и пыли в созвездии Лебедя.,supernova remnant,остаток сверхновой,data/curated_space_objects/images/veil_nebula.jpg
